{
  "schema": "voc-method.v1",
  "methodId": "22222222-2222-2222-2222-222222222222",
  "version": 1,
  "pollutants": [
    {
      "code": "a05002",
      "name": "总烃",
      "startS": 4.0,
      "endS": 6.0,
      "paddingS": 0.5,
      "alignMode": "none",
      "baselineMode": "linear_endpoints",
      "threshold": 0.5
    }
  ]
}

